need,why,status,how_to_use
physical timestep dt for each family,Converts tau_0/tau_1 and dwell-window statistics from model units into seconds.,missing,"Pass --dt-json dt.json with keys parity, x_loop, z_loop."
calibration labels or known state preparations,Maps hidden state 0/1 to even/odd parity or physical X/Z loop states and enables true assignment error/readout fidelity.,missing,Pass --state-label-json for state names and use qcvv_calibrate.py for confusion matrices/fidelity.
raw or prepared I/Q traces with sample_dt and run/time metadata,"Needed for physical drift analysis, raw trace dwell-time posteriors, repeated-readout/QND metrics, and model inference on new data.",not available in extracted model artifacts unless prepared bundles are accessible locally,"Keep columns such as family, run_id, sequence_id, sample_index, t, I, Q, sample_dt."
repeated-readout or pre/post measurement experiments,Needed to quantify measurement backaction and QND repeatability rather than only decoder confidence.,not inferable from model artifacts alone,Prepare paired pre/post or repeated measurements and align them by run/sequence/time.
individual CNN-GRU/DMM prediction exports if you want prediction-level comparison for those baselines,"The individual bundle has checkpoints and training metrics for some neural models, but no prediction NPZ for CNN-GRU/DMM in the current project files.",missing when prediction_npz is blank in artifact_inventory.csv,"Run model inference/export on a shared held-out dataset, then rerun qcvv_extract.py."
